[
  {"num":1,"week":1,"phase":"Phase 1","month":1,"focus":"Repository orientation and proof system","artifact":"tracking/notes/day-01.md","dsa":{"target":3,"easy":3,"medium":0,"hard":0,"total":3},"csBlock":"Arrays and strings fundamentals","aiArtifact":"tracking/ai/week-01-ai-opportunity-note.md","aiLayer":"Python CLI foundations and algorithmic thinking","resource":"CS50x + CS50 Python + Kaggle Python","aiMlArtifact":"tracking/ai/week-01-python-cli-evidence.md"},
  {"num":2,"week":1,"phase":"Phase 1","month":1,"focus":"Git workflow, branch hygiene, and commit standards","artifact":"tracking/notes/day-02.md","dsa":{"target":4,"easy":4,"medium":0,"hard":0,"total":7},"csBlock":"Arrays and strings fundamentals","aiArtifact":"tracking/ai/week-01-ai-opportunity-note.md","aiLayer":"Python CLI foundations and algorithmic thinking","resource":"CS50x + CS50 Python + Kaggle Python","aiMlArtifact":"tracking/ai/week-01-python-cli-evidence.md"},
  {"num":3,"week":1,"phase":"Phase 1","month":1,"focus":"CLI workflow and environment setup","artifact":"tracking/notes/day-03.md","dsa":{"target":4,"easy":3,"medium":1,"hard":0,"total":11},"csBlock":"Arrays and strings fundamentals","aiArtifact":"tracking/ai/week-01-ai-opportunity-note.md","aiLayer":"Python CLI foundations and algorithmic thinking","resource":"CS50x + CS50 Python + Kaggle Python","aiMlArtifact":"tracking/ai/week-01-python-cli-evidence.md"},
  {"num":4,"week":1,"phase":"Phase 1","month":1,"focus":"Markdown evidence templates","artifact":"tracking/notes/day-04.md","dsa":{"target":4,"easy":3,"medium":1,"hard":0,"total":15},"csBlock":"Arrays and strings fundamentals","aiArtifact":"tracking/ai/week-01-ai-opportunity-note.md","aiLayer":"Python CLI foundations and algorithmic thinking","resource":"CS50x + CS50 Python + Kaggle Python","aiMlArtifact":"tracking/ai/week-01-python-cli-evidence.md"},
  {"num":5,"week":1,"phase":"Phase 1","month":1,"focus":"HTML semantic structure refresher","artifact":"tracking/notes/day-05.md","dsa":{"target":5,"easy":4,"medium":1,"hard":0,"total":20},"csBlock":"Arrays and strings fundamentals","aiArtifact":"tracking/ai/week-01-ai-opportunity-note.md","aiLayer":"Python CLI foundations and algorithmic thinking","resource":"CS50x + CS50 Python + Kaggle Python","aiMlArtifact":"tracking/ai/week-01-python-cli-evidence.md"},
  {"num":6,"week":1,"phase":"Phase 1","month":1,"focus":"CSS layout and responsive rules","artifact":"tracking/notes/day-06.md","dsa":{"target":5,"easy":4,"medium":1,"hard":0,"total":25},"csBlock":"Arrays and strings fundamentals","aiArtifact":"tracking/ai/week-01-ai-opportunity-note.md","aiLayer":"Python CLI foundations and algorithmic thinking","resource":"CS50x + CS50 Python + Kaggle Python","aiMlArtifact":"tracking/ai/week-01-python-cli-evidence.md"},
  {"num":7,"week":1,"phase":"Phase 1","month":1,"focus":"JavaScript fundamentals audit","artifact":"tracking/notes/day-07.md","dsa":{"target":5,"easy":3,"medium":2,"hard":0,"total":30},"csBlock":"Arrays and strings fundamentals","aiArtifact":"tracking/ai/week-01-ai-opportunity-note.md","aiLayer":"Python CLI foundations and algorithmic thinking","resource":"CS50x + CS50 Python + Kaggle Python","aiMlArtifact":"tracking/ai/week-01-python-cli-evidence.md"},
  {"num":8,"week":1,"phase":"Phase 1","month":1,"focus":"Debugging journal and hypothesis loop","artifact":"tracking/notes/day-08.md","dsa":{"target":4,"easy":2,"medium":2,"hard":0,"total":34},"csBlock":"Arrays and strings fundamentals","aiArtifact":"tracking/ai/week-01-ai-opportunity-note.md","aiLayer":"Python CLI foundations and algorithmic thinking","resource":"CS50x + CS50 Python + Kaggle Python","aiMlArtifact":"tracking/ai/week-01-python-cli-evidence.md"},
  {"num":9,"week":1,"phase":"Phase 1","month":1,"focus":"Accessibility baseline note","artifact":"tracking/notes/day-09.md","dsa":{"target":4,"easy":2,"medium":2,"hard":0,"total":38},"csBlock":"Arrays and strings fundamentals","aiArtifact":"tracking/ai/week-01-ai-opportunity-note.md","aiLayer":"Python CLI foundations and algorithmic thinking","resource":"CS50x + CS50 Python + Kaggle Python","aiMlArtifact":"tracking/ai/week-01-python-cli-evidence.md"},
  {"num":10,"week":1,"phase":"Phase 1","month":1,"focus":"Week 1 operating-system review","artifact":"tracking/notes/day-10-checkpoint.md","dsa":{"target":5,"easy":3,"medium":2,"hard":0,"total":43},"csBlock":"Arrays and strings fundamentals","aiArtifact":"tracking/ai/week-01-ai-opportunity-note.md","aiLayer":"Python CLI foundations and algorithmic thinking","resource":"CS50x + CS50 Python + Kaggle Python","aiMlArtifact":"tracking/ai/week-01-python-cli-evidence.md"},
  {"num":11,"week":2,"phase":"Phase 1","month":1,"focus":"DOM traversal and event propagation","artifact":"tracking/notes/day-11.md","dsa":{"target":5,"easy":4,"medium":1,"hard":0,"total":48},"csBlock":"Hash maps, two pointers, sliding window","aiArtifact":"tracking/ai/week-02-ai-ux-risk-note.md","aiLayer":"Pandas, NumPy, SQL basics, and data wrangling","resource":"Kaggle Pandas + Kaggle SQL + CS50 Python","aiMlArtifact":"tracking/ai/week-02-data-wrangling-evidence.md"},
  {"num":12,"week":2,"phase":"Phase 1","month":1,"focus":"Form validation and accessible errors","artifact":"tracking/notes/day-12.md","dsa":{"target":5,"easy":3,"medium":2,"hard":0,"total":53},"csBlock":"Hash maps, two pointers, sliding window","aiArtifact":"tracking/ai/week-02-ai-ux-risk-note.md","aiLayer":"Pandas, NumPy, SQL basics, and data wrangling","resource":"Kaggle Pandas + Kaggle SQL + CS50 Python","aiMlArtifact":"tracking/ai/week-02-data-wrangling-evidence.md"},
  {"num":13,"week":2,"phase":"Phase 1","month":1,"focus":"Fetch, promises, and failure handling","artifact":"tracking/notes/day-13.md","dsa":{"target":5,"easy":3,"medium":2,"hard":0,"total":58},"csBlock":"Hash maps, two pointers, sliding window","aiArtifact":"tracking/ai/week-02-ai-ux-risk-note.md","aiLayer":"Pandas, NumPy, SQL basics, and data wrangling","resource":"Kaggle Pandas + Kaggle SQL + CS50 Python","aiMlArtifact":"tracking/ai/week-02-data-wrangling-evidence.md"},
  {"num":14,"week":2,"phase":"Phase 1","month":1,"focus":"Browser storage and cache behavior","artifact":"tracking/notes/day-14.md","dsa":{"target":5,"easy":2,"medium":3,"hard":0,"total":63},"csBlock":"Hash maps, two pointers, sliding window","aiArtifact":"tracking/ai/week-02-ai-ux-risk-note.md","aiLayer":"Pandas, NumPy, SQL basics, and data wrangling","resource":"Kaggle Pandas + Kaggle SQL + CS50 Python","aiMlArtifact":"tracking/ai/week-02-data-wrangling-evidence.md"},
  {"num":15,"week":2,"phase":"Phase 1","month":1,"focus":"Async debugging with DevTools","artifact":"tracking/notes/day-15.md","dsa":{"target":4,"easy":2,"medium":2,"hard":0,"total":67},"csBlock":"Hash maps, two pointers, sliding window","aiArtifact":"tracking/ai/week-02-ai-ux-risk-note.md","aiLayer":"Pandas, NumPy, SQL basics, and data wrangling","resource":"Kaggle Pandas + Kaggle SQL + CS50 Python","aiMlArtifact":"tracking/ai/week-02-data-wrangling-evidence.md"},
  {"num":16,"week":2,"phase":"Phase 1","month":1,"focus":"JavaScript data structures practice","artifact":"tracking/notes/day-16.md","dsa":{"target":4,"easy":1,"medium":3,"hard":0,"total":71},"csBlock":"Hash maps, two pointers, sliding window","aiArtifact":"tracking/ai/week-02-ai-ux-risk-note.md","aiLayer":"Pandas, NumPy, SQL basics, and data wrangling","resource":"Kaggle Pandas + Kaggle SQL + CS50 Python","aiMlArtifact":"tracking/ai/week-02-data-wrangling-evidence.md"},
  {"num":17,"week":2,"phase":"Phase 1","month":1,"focus":"Client-side performance measurement","artifact":"tracking/notes/day-17.md","dsa":{"target":4,"easy":1,"medium":3,"hard":0,"total":75},"csBlock":"Hash maps, two pointers, sliding window","aiArtifact":"tracking/ai/week-02-ai-ux-risk-note.md","aiLayer":"Pandas, NumPy, SQL basics, and data wrangling","resource":"Kaggle Pandas + Kaggle SQL + CS50 Python","aiMlArtifact":"tracking/ai/week-02-data-wrangling-evidence.md"},
  {"num":18,"week":2,"phase":"Phase 1","month":1,"focus":"Security basics: XSS and safe rendering","artifact":"tracking/notes/day-18.md","dsa":{"target":3,"easy":1,"medium":2,"hard":0,"total":78},"csBlock":"Hash maps, two pointers, sliding window","aiArtifact":"tracking/ai/week-02-ai-ux-risk-note.md","aiLayer":"Pandas, NumPy, SQL basics, and data wrangling","resource":"Kaggle Pandas + Kaggle SQL + CS50 Python","aiMlArtifact":"tracking/ai/week-02-data-wrangling-evidence.md"},
  {"num":19,"week":2,"phase":"Phase 1","month":1,"focus":"Code review of frontend fundamentals","artifact":"tracking/reviews/day-19-code-review-of-frontend-fundamentals.md","dsa":{"target":4,"easy":1,"medium":3,"hard":0,"total":82},"csBlock":"Hash maps, two pointers, sliding window","aiArtifact":"tracking/ai/week-02-ai-ux-risk-note.md","aiLayer":"Pandas, NumPy, SQL basics, and data wrangling","resource":"Kaggle Pandas + Kaggle SQL + CS50 Python","aiMlArtifact":"tracking/ai/week-02-data-wrangling-evidence.md"},
  {"num":20,"week":2,"phase":"Phase 1","month":1,"focus":"Phase 1 portfolio checkpoint","artifact":"tracking/notes/day-20-checkpoint.md","dsa":{"target":5,"easy":2,"medium":3,"hard":0,"total":87},"csBlock":"Hash maps, two pointers, sliding window","aiArtifact":"tracking/ai/week-02-ai-ux-risk-note.md","aiLayer":"Pandas, NumPy, SQL basics, and data wrangling","resource":"Kaggle Pandas + Kaggle SQL + CS50 Python","aiMlArtifact":"tracking/ai/week-02-data-wrangling-evidence.md"},
  {"num":21,"week":3,"phase":"Phase 2","month":1,"focus":"Node runtime and event loop notes","artifact":"tracking/notes/day-21.md","dsa":{"target":4,"easy":2,"medium":2,"hard":0,"total":91},"csBlock":"Stack, queue, linked list, binary search","aiArtifact":"tracking/ai/week-03-model-gateway-contract.md","aiLayer":"Python CLI release and API boundary thinking","resource":"CS50 Python + freeCodeCamp Back End APIs + MIT 6.006","aiMlArtifact":"tracking/ai/week-03-python-cli-release.md"},